{
  "manifestVersion": 1,
  "assetId": "RB-01-rider-bike",
  "displayName": "Arcade Rider And Pole Voima K2",
  "role": "rider-bike",
  "source": {
    "kind": "project-authored",
    "provider": "GoldenCheetah",
    "author": "GoldenCheetah contributors",
    "url": "https://github.com/kaartine/GoldenCheetah/blob/master/contrib/workout-game-assets/blender/sources/WG_RiderBike.blend",
    "retrievedAt": "2026-09-13",
    "originalFileName": "WG_RiderBike.blend",
    "generator": "Blender",
    "generatorVersion": "4.0.2",
    "promptOrScript": "contrib/workout-game-assets/blender/sources/WG_RiderBike.blend; contrib/workout-game-assets/blender/generate_rider_bike.py"
  },
  "license": {
    "spdxId": "GPL-2.0-or-later",
    "licenseUrl": "https://www.gnu.org/licenses/old-licenses/gpl-2.0.html",
    "attribution": "GoldenCheetah contributors",
    "modificationAllowed": true,
    "redistributionAllowed": true,
    "decision": "allow",
    "policyVersion": "2026-08-25",
    "archivedLicensePath": "COPYING",
    "distributionScopes": [
      "source",
      "appimage",
      "screenshots-video"
    ],
    "conditions": [],
    "reviewNotes": "Project-authored deterministic geometry reconstructing the Pole Voima K2 from published dimensions and public product views. No external model, CAD, texture, logo, face scan, portrait or photograph pixels are embedded."
  },
  "files": [
    {
      "path": "contrib/workout-game-assets/blender/generate_rider_bike.py",
      "purpose": "source"
    },
    {
      "path": "contrib/workout-game-assets/blender/sources/WG_RiderBike.blend",
      "purpose": "source"
    },
    {
      "path": "contrib/workout-game-assets/blender/render_rider_bike_audit.py",
      "purpose": "source"
    },
    {
      "path": "contrib/workout-game-assets/generated/WG_RiderBike.glb",
      "purpose": "intermediate"
    },
    {
      "path": "contrib/workout-game-assets/audits/RB-01/RB-01-audit.json",
      "purpose": "preview"
    },
    {
      "path": "contrib/workout-game-assets/audits/RB-01/RB-01-front.png",
      "purpose": "preview"
    },
    {
      "path": "contrib/workout-game-assets/audits/RB-01/RB-01-rear.png",
      "purpose": "preview"
    },
    {
      "path": "contrib/workout-game-assets/audits/RB-01/RB-01-side.png",
      "purpose": "preview"
    },
    {
      "path": "contrib/workout-game-assets/audits/RB-01/RB-01-chase.png",
      "purpose": "preview"
    },
    {
      "path": "src/Train/qml/WorkoutGameRiderBike.qml",
      "purpose": "runtime"
    },
    {
      "path": "src/Train/qml/assets/meshes/geo_BikeComponents_LOD0_mesh.mesh",
      "purpose": "runtime"
    },
    {
      "path": "src/Train/qml/assets/meshes/geo_Crank_LOD0_mesh.mesh",
      "purpose": "runtime"
    },
    {
      "path": "src/Train/qml/assets/meshes/geo_Eyewear_LOD0_mesh.mesh",
      "purpose": "runtime"
    },
    {
      "path": "src/Train/qml/assets/meshes/geo_Fork_LOD0_mesh.mesh",
      "purpose": "runtime"
    },
    {
      "path": "src/Train/qml/assets/meshes/geo_FrontWheel_LOD0_mesh.mesh",
      "purpose": "runtime"
    },
    {
      "path": "src/Train/qml/assets/meshes/geo_HairBeard_LOD0_mesh.mesh",
      "purpose": "runtime"
    },
    {
      "path": "src/Train/qml/assets/meshes/geo_Head_LOD0_mesh.mesh",
      "purpose": "runtime"
    },
    {
      "path": "src/Train/qml/assets/meshes/geo_Helmet_LOD0_mesh.mesh",
      "purpose": "runtime"
    },
    {
      "path": "src/Train/qml/assets/meshes/geo_HelmetAccent_LOD0_mesh.mesh",
      "purpose": "runtime"
    },
    {
      "path": "src/Train/qml/assets/meshes/geo_JerseyAccent_LOD0_mesh.mesh",
      "purpose": "runtime"
    },
    {
      "path": "src/Train/qml/assets/meshes/geo_Limb_LOD0_mesh.mesh",
      "purpose": "runtime"
    },
    {
      "path": "src/Train/qml/assets/meshes/geo_MainFrame_LOD0_mesh.mesh",
      "purpose": "runtime"
    },
    {
      "path": "src/Train/qml/assets/meshes/geo_RearShock_LOD0_mesh.mesh",
      "purpose": "runtime"
    },
    {
      "path": "src/Train/qml/assets/meshes/geo_RearWheel_LOD0_mesh.mesh",
      "purpose": "runtime"
    },
    {
      "path": "src/Train/qml/assets/meshes/geo_Shadow_LOD0_mesh.mesh",
      "purpose": "runtime"
    },
    {
      "path": "src/Train/qml/assets/meshes/geo_Swingarm_LOD0_mesh.mesh",
      "purpose": "runtime"
    },
    {
      "path": "src/Train/qml/assets/meshes/geo_Torso_LOD0_mesh.mesh",
      "purpose": "runtime"
    },
    {
      "path": "src/Resources/images/workout-game-surface-rider.png",
      "purpose": "texture"
    },
    {
      "path": "contrib/workout-game-assets/install_rider_bike_asset.py",
      "purpose": "source"
    },
    {
      "path": "contrib/workout-game-assets/rebuild_rider_bike.sh",
      "purpose": "source"
    }
  ],
  "processing": {
    "tool": "Blender and Qt Balsam",
    "toolVersion": "Blender 4.0.2; Qt Balsam 6.8.3",
    "steps": [
      "Open the committed editable Blender source in Blender 4.0.2.",
      "Run generate_rider_bike.py in source mode with dimension, pivot, topology, rights-metadata and budget checks.",
      "Export glTF 2.0 GLB with opaque materials, extras and no cameras, lights, textures or animations.",
      "Export the source twice and require byte-identical GLB output.",
      "Validate the GLB structure, metadata, transforms, bounds and budgets with the repository asset policy.",
      "Convert the candidate twice with Qt Balsam 6.8.3 and compare every generated output byte.",
      "Require the exact 17-mesh runtime inventory used by the existing animation pivots.",
      "Package the converted meshes and shared rider surface texture in workout-game-assets.qrc.",
      "Render front, rear, side and chase audit views twice with fixed pose, cameras, field of view and lighting.",
      "Require repeated audit output to be byte-identical before installation."
    ]
  },
  "technical": {
    "format": "glb",
    "unitMeters": 1.0,
    "upAxis": "+Y",
    "forwardAxis": "+Z",
    "glbBytes": 527188,
    "trianglesLod0": 7494,
    "materials": 8,
    "textureBytes": 0,
    "nodes": [
      "GEO_BikeComponents_LOD0",
      "GEO_Crank_LOD0",
      "GEO_Eyewear_LOD0",
      "GEO_Fork_LOD0",
      "GEO_FrontWheel_LOD0",
      "GEO_HairBeard_LOD0",
      "GEO_Head_LOD0",
      "GEO_HelmetAccent_LOD0",
      "GEO_Helmet_LOD0",
      "GEO_JerseyAccent_LOD0",
      "GEO_Limb_LOD0",
      "GEO_MainFrame_LOD0",
      "GEO_RearShock_LOD0",
      "GEO_RearWheel_LOD0",
      "GEO_Shadow_LOD0",
      "GEO_Swingarm_LOD0",
      "GEO_Torso_LOD0",
      "PIVOT_CAMERA_TARGET",
      "PIVOT_CRANK",
      "PIVOT_FRONT_AXLE",
      "PIVOT_PELVIS",
      "PIVOT_REAR_AXLE",
      "PIVOT_SHADOW",
      "PIVOT_SHOCK_FRAME",
      "PIVOT_SHOCK_SWINGARM",
      "PIVOT_STEER",
      "PIVOT_SWINGARM_FRAME",
      "PIVOT_UPPER_LINK_FRAME",
      "PIVOT_UPPER_LINK_SWINGARM",
      "ROOT_RiderBike"
    ],
    "animations": [],
    "allowedExtensions": [],
    "boundsMeters": {
      "minimum": [
        -0.44999998807907104,
        -0.2297762781381607,
        -0.8324999809265137
      ],
      "maximum": [
        0.44999998807907104,
        1.1100000143051147,
        1.2354999780654907
      ]
    },
    "budgets": {
      "maxGlbBytes": 614400,
      "maxTrianglesLod0": 18000,
      "maxMaterials": 8,
      "maxTextureBytes": 1024
    }
  },
  "physics": {
    "authority": "external",
    "interaction": "visual-only",
    "collisionProxy": { "kind": "none" }
  },
  "review": {
    "status": "approved",
    "trademarkStatus": "clear",
    "personReleaseStatus": "not-applicable",
    "propertyReleaseStatus": "not-applicable",
    "reviewer": "GoldenCheetah asset engineering and runtime integration audit",
    "reviewedAt": "2026-09-13",
    "notes": "Approved stylized rider and Pole Voima K2 visual reconstruction. The bicycle geometry is measured from public product photography and Pole's published K2 dimensions; no source CAD or photograph pixels are included. The editable Blender source and generated runtime meshes preserve the established axle, crank, steering, pelvis, shadow and camera pivots plus the snapshot-driven wheel, pedal, suspension and rider-pose animation contract. The model uses an open twin-link rear triangle, tapered frame members, detailed cockpit, one-by drivetrain, platform pedals, suspension, logo-free deep-coverage enduro helmet with an extended visor and large black treaded tires. It contains no person likeness, branded tread, logo or source mesh. No endorsement is claimed or implied. Deterministic Blender export, Balsam conversion, packaged-resource loading and fixed-view visual audits are release requirements."
  }
}
