{
  "manifestVersion": 1,
  "assetId": "FT-12-gap-jump-three-line",
  "displayName": "Workout Game Three-Line Gap Jump",
  "role": "feature",
  "source": {
    "kind": "project-authored",
    "provider": "GoldenCheetah",
    "author": "GoldenCheetah contributors",
    "url": "https://github.com/kaartine/GoldenCheetah/blob/master/contrib/workout-game-assets/blender/generate_gap_jump.py",
    "retrievedAt": "2026-09-05",
    "originalFileName": "generate_gap_jump.py",
    "generator": "Blender Python",
    "generatorVersion": "4.0.2",
    "promptOrScript": "contrib/workout-game-assets/blender/generate_gap_jump.py"
  },
  "license": {
    "spdxId": "GPL-2.0-or-later",
    "licenseUrl": "https://www.gnu.org/licenses/old-licenses/gpl-2.0.html",
    "attribution": "GoldenCheetah contributors",
    "modificationAllowed": true,
    "redistributionAllowed": true,
    "decision": "allow",
    "policyVersion": "2026-08-25",
    "archivedLicensePath": "COPYING",
    "distributionScopes": [
      "source",
      "appimage",
      "screenshots-video"
    ],
    "conditions": [],
    "reviewNotes": "Project-authored geometry, materials and audit views. No external model, texture, image, scan, AI asset or trademarked design is used."
  },
  "files": [
    {
      "path": "contrib/workout-game-assets/blender/generate_gap_jump.py",
      "purpose": "source"
    },
    {
      "path": "contrib/workout-game-assets/blender/render_gap_jump_audit.py",
      "purpose": "source"
    },
    {
      "path": "contrib/workout-game-assets/generated/WG_GapJumpThreeLine.glb",
      "purpose": "intermediate"
    },
    {
      "path": "src/Train/qml/assets/Wg_GapJumpThreeLine.qml",
      "purpose": "runtime"
    },
    {
      "path": "src/Train/qml/assets/meshes/geo_GapJumpAccents_LOD0_mesh.mesh",
      "purpose": "runtime"
    },
    {
      "path": "src/Train/qml/assets/meshes/geo_GapJumpGround_LOD0_mesh.mesh",
      "purpose": "runtime"
    },
    {
      "path": "src/Train/qml/assets/meshes/geo_GapJumpTread_LOD0_mesh.mesh",
      "purpose": "runtime"
    },
    {
      "path": "contrib/workout-game-assets/audits/FT-12/FT-12-audit.json",
      "purpose": "reference"
    },
    {
      "path": "contrib/workout-game-assets/audits/FT-12/FT-12-chase.png",
      "purpose": "preview"
    },
    {
      "path": "contrib/workout-game-assets/audits/FT-12/FT-12-overhead.png",
      "purpose": "preview"
    },
    {
      "path": "contrib/workout-game-assets/audits/FT-12/FT-12-side-short.png",
      "purpose": "preview"
    },
    {
      "path": "contrib/workout-game-assets/audits/FT-12/FT-12-side-medium.png",
      "purpose": "preview"
    },
    {
      "path": "contrib/workout-game-assets/audits/FT-12/FT-12-side-long.png",
      "purpose": "preview"
    }
  ],
  "processing": {
    "tool": "Blender and Qt Balsam",
    "toolVersion": "Blender 4.0.2; Qt Balsam 6.8.3",
    "steps": [
      "Start pinned Blender 4.0.2 with --background --factory-startup.",
      "Generate the 40.7 metre socketed three-line tile from the canonical WorkoutGameGapJumpGeometry difficulty 0.5 profile.",
      "Generate packed tread, recessed gap floor, sculpted shoulders, lip and landing faces with no external inputs or texture payload.",
      "Validate finite triangular topology, exact ordinary-trail sockets, marker inventory, external physics authority and the 3600-triangle budget.",
      "Export a self-contained glTF 2.0 GLB with extras and no camera, light, animation or external URI.",
      "Reproduce the GLB byte for byte and validate it with Khronos glTF Validator 2.0.0-dev.3.10.",
      "Convert the reviewed GLB twice with Qt Balsam 6.8.3 and compare every generated byte.",
      "Import the GLB and render fixed chase, overhead and three side audit views at 47 degree FOV."
    ]
  },
  "technical": {
    "format": "glb",
    "unitMeters": 1.0,
    "upAxis": "+Y",
    "forwardAxis": "+Z",
    "glbBytes": 89252,
    "trianglesLod0": 1112,
    "materials": 3,
    "textureBytes": 0,
    "nodes": [
      "GEO_GapJumpAccents_LOD0",
      "GEO_GapJumpGround_LOD0",
      "GEO_GapJumpTread_LOD0",
      "MARKER_DECISION",
      "MARKER_LONG_APEX",
      "MARKER_LONG_LAND",
      "MARKER_LONG_LIP",
      "MARKER_MEDIUM_APEX",
      "MARKER_MEDIUM_LAND",
      "MARKER_MEDIUM_LIP",
      "MARKER_MERGE_START",
      "MARKER_RECOVERY",
      "MARKER_SHORT_APEX",
      "MARKER_SHORT_LAND",
      "MARKER_SHORT_LIP",
      "SOCKET_IN",
      "SOCKET_OUT",
      "ROOT_GapJumpThreeLine"
    ],
    "animations": [],
    "allowedExtensions": [],
    "boundsMeters": {
      "minimum": [-6.0, -0.6234232783317566, 0.0],
      "maximum": [6.0, 0.7919999957084656, 40.70000076293945]
    },
    "sockets": [
      {
        "name": "SOCKET_IN",
        "positionMeters": [0.0, 0.0, 0.0],
        "halfWidthMeters": 0.68
      },
      {
        "name": "SOCKET_OUT",
        "positionMeters": [0.0, 0.0, 40.7],
        "halfWidthMeters": 0.68
      }
    ],
    "budgets": {
      "maxGlbBytes": 131072,
      "maxTrianglesLod0": 3600,
      "maxMaterials": 3,
      "maxTextureBytes": 0
    }
  },
  "physics": {
    "authority": "external",
    "interaction": "rideable-feature",
    "surface": {
      "coulombFriction": 1.1,
      "restitution": 0.0
    },
    "collisionProxy": { "kind": "none" }
  },
  "review": {
    "status": "candidate",
    "trademarkStatus": "not-applicable",
    "personReleaseStatus": "not-applicable",
    "propertyReleaseStatus": "not-applicable",
    "reviewer": "GoldenCheetah engineering asset audit",
    "reviewedAt": "2026-09-05",
    "notes": "Asset-package candidate only. Fixed-camera GLB renders show one shared approach, three visibly progressive open gaps, recessed bowls, distinct landing knuckles and one merged recovery without HUD text. Runtime must replace its procedural gap surface with this component rather than layer both surfaces. Physics, collision, speed selection, rider motion, target-GPU cost and integrated user acceptance remain separate FTR-12 gates."
  }
}
