{
  "manifestVersion": 1,
  "assetId": "FT-04-drop-greybox",
  "displayName": "Workout Game Drop Greybox",
  "role": "feature",
  "source": {
    "kind": "project-authored",
    "provider": "GoldenCheetah",
    "author": "GoldenCheetah contributors",
    "url": "https://github.com/kaartine/GoldenCheetah/blob/master/contrib/workout-game-assets/blender/generate_drop.py",
    "retrievedAt": "2026-09-12",
    "originalFileName": "generate_drop.py",
    "generator": "Blender",
    "generatorVersion": "4.0.2",
    "promptOrScript": "contrib/workout-game-assets/blender/generate_drop.py"
  },
  "license": {
    "spdxId": "GPL-2.0-or-later",
    "licenseUrl": "https://www.gnu.org/licenses/old-licenses/gpl-2.0.html",
    "attribution": "GoldenCheetah contributors",
    "modificationAllowed": true,
    "redistributionAllowed": true,
    "decision": "allow",
    "policyVersion": "2026-08-25",
    "archivedLicensePath": "COPYING",
    "distributionScopes": [
      "source",
      "appimage",
      "screenshots-video"
    ],
    "conditions": [],
    "reviewNotes": "Project-authored geometry with no external model, texture or material."
  },
  "files": [
    {
      "path": "contrib/workout-game-assets/blender/generate_drop.py",
      "purpose": "source"
    },
    {
      "path": "contrib/workout-game-assets/generated/WG_Drop_Greybox.glb",
      "purpose": "intermediate"
    },
    {
      "path": "src/Train/qml/assets/Wg_Drop_Greybox.qml",
      "purpose": "runtime"
    },
    {
      "path": "src/Train/qml/assets/meshes/geo_DropFace_LOD0_mesh.mesh",
      "purpose": "runtime"
    }
  ],
  "processing": {
    "tool": "Blender and Qt Balsam",
    "toolVersion": "Blender 4.0.2; Qt Balsam 6.8.3",
    "steps": [
      "Start Blender with --background --factory-startup.",
      "Run generate_drop.py with its internal topology, envelope and socket checks.",
      "Export glTF 2.0 GLB with opaque materials, extras and no cameras, lights or animations.",
      "Validate with Khronos glTF Validator 2.0.0-dev.3.10.",
      "Convert the reviewed GLB with Qt Balsam 6.8.3."
    ]
  },
  "technical": {
    "format": "glb",
    "unitMeters": 1.0,
    "upAxis": "+Y",
    "forwardAxis": "+Z",
    "glbBytes": 7308,
    "trianglesLod0": 64,
    "materials": 2,
    "textureBytes": 0,
    "nodes": [
      "ROOT_Drop",
      "GEO_DropFace_LOD0",
      "SOCKET_IN",
      "SOCKET_OUT",
      "MARKER_PREPARE",
      "MARKER_DECISION",
      "MARKER_ACTION",
      "MARKER_LIP",
      "MARKER_AIR",
      "MARKER_LAND",
      "MARKER_RECOVERY"
    ],
    "animations": [],
    "allowedExtensions": [],
    "boundsMeters": {
      "minimum": [
        -1.7000000476837158,
        -0.699999988079071,
        9.180000305175781
      ],
      "maximum": [
        1.7000000476837158,
        0.30000001192092896,
        10.550000190734863
      ]
    },
    "sockets": [
      {
        "name": "SOCKET_IN",
        "positionMeters": [
          0.0,
          0.0,
          0.0
        ],
        "halfWidthMeters": 0.68
      },
      {
        "name": "SOCKET_OUT",
        "positionMeters": [
          0.0,
          0.0,
          24.0
        ],
        "halfWidthMeters": 0.68
      }
    ],
    "budgets": {
      "maxGlbBytes": 16384,
      "maxTrianglesLod0": 64,
      "maxMaterials": 2,
      "maxTextureBytes": 0
    }
  },
  "physics": {
    "authority": "external",
    "interaction": "rideable-feature",
    "surface": {
      "coulombFriction": 1.1,
      "restitution": 0.0
    },
    "collisionProxy": { "kind": "none" }
  },
  "review": {
    "status": "approved",
    "trademarkStatus": "not-applicable",
    "personReleaseStatus": "not-applicable",
    "propertyReleaseStatus": "not-applicable",
    "reviewer": "GoldenCheetah engineering audit",
    "reviewedAt": "2026-09-12",
    "notes": "Approved project-authored broad undercut drop face with a long contrasting stone lip and asymmetric low-poly rock shoulders outside the authoritative tread. The 0.70 m source scale, identity pivot, exact 24.0 m profile sockets and all authored markers are preserved, with no duplicated trail, landing or bypass ground. Runtime trail and Box2D remain authoritative for the larger difficulty-dependent drop."
  }
}
