{
  "manifestVersion": 1,
  "assetId": "TR-08-surface-atlas",
  "displayName": "Workout Game Pixel Surface Atlas",
  "role": "texture",
  "source": {
    "kind": "project-authored",
    "provider": "GoldenCheetah",
    "author": "GoldenCheetah contributors",
    "url": "https://github.com/kaartine/GoldenCheetah/blob/master/contrib/workout-game-assets/generate_surface_atlas.py",
    "retrievedAt": "2026-08-26",
    "originalFileName": "generate_surface_atlas.py",
    "generator": "Python standard library",
    "generatorVersion": "3.12",
    "promptOrScript": "contrib/workout-game-assets/generate_surface_atlas.py"
  },
  "license": {
    "spdxId": "GPL-2.0-or-later",
    "licenseUrl": "https://www.gnu.org/licenses/old-licenses/gpl-2.0.html",
    "attribution": "GoldenCheetah contributors",
    "modificationAllowed": true,
    "redistributionAllowed": true,
    "decision": "allow",
    "policyVersion": "2026-08-25",
    "archivedLicensePath": "COPYING",
    "distributionScopes": ["source", "appimage", "screenshots-video"],
    "conditions": [],
    "reviewNotes": "Project-authored deterministic palette and pixel patterns with no external image input."
  },
  "files": [
    {
      "path": "contrib/workout-game-assets/generate_surface_atlas.py",
      "purpose": "source"
    },
    {
      "path": "src/Resources/images/workout-game-surface-atlas.png",
      "purpose": "texture"
    },
    {
      "path": "src/Resources/images/workout-game-surface-forest.png",
      "purpose": "texture"
    },
    {
      "path": "src/Resources/images/workout-game-surface-dirt.png",
      "purpose": "texture"
    },
    {
      "path": "src/Resources/images/workout-game-surface-stone.png",
      "purpose": "texture"
    },
    {
      "path": "src/Resources/images/workout-game-surface-wood.png",
      "purpose": "texture"
    },
    {
      "path": "src/Resources/images/workout-game-surface-rider.png",
      "purpose": "texture"
    }
  ],
  "processing": {
    "tool": "Python standard library",
    "toolVersion": "3.12",
    "steps": [
      "Generate five fixed RGBA palettes with deterministic irregular four-pixel blocks.",
      "Assemble forest, dirt, stone, wood and rider detail into one 96 by 64 master atlas.",
      "Export five 32 by 32 runtime tiles from the same source pixels.",
      "Encode all PNG scanlines with filter zero and zlib level nine.",
      "Package every image in qrc and sample runtime tiles with repeat wrapping, nearest magnification, linear minification and mipmaps."
    ]
  },
  "technical": {
    "format": "png",
    "unitMeters": 1.0,
    "upAxis": "+Y",
    "forwardAxis": "+Z",
    "materials": 5,
    "textureBytes": 1561,
    "animations": [],
    "allowedExtensions": [],
    "budgets": {
      "maxGlbBytes": 1,
      "maxTrianglesLod0": 0,
      "maxMaterials": 5,
      "maxTextureBytes": 16384
    }
  },
  "physics": {
    "authority": "external",
    "interaction": "visual-only",
    "collisionProxy": { "kind": "none" }
  },
  "review": {
    "status": "approved",
    "trademarkStatus": "not-applicable",
    "personReleaseStatus": "not-applicable",
    "propertyReleaseStatus": "not-applicable",
    "reviewer": "GoldenCheetah engineering audit",
    "reviewedAt": "2026-08-26",
    "notes": "Approved after integrated X11/OpenGL still and 72-frame completed/bypassed motion review; mipmapped linear minification prevents distant shimmer while nearest magnification preserves close pixel blocks."
  }
}
